id,question_vi,option1_vi,option2_vi,option3_vi,option4_vi,explanation_vi
1,"Theo Luật cơ bản về xây dựng xã hội tuần hoàn, điều nào KHÔNG nằm trong 3R?","Recycle (Tái chế)","Reuse (Tái sử dụng)","Reduce (Giảm thiểu)","Refuse (Từ chối)","3R bao gồm Reduce, Reuse, Recycle."
2,"Theo Luật kinh doanh đồ cũ, Thông báo thay đổi phải được thực hiện trong bao nhiêu ngày?","Trong 7 ngày","Trong 10 ngày","Trong 14 ngày","Trong 30 ngày","Phải thông báo cho Ủy ban An ninh công cộng trong vòng 14 ngày."
3,"Mặt hàng nào bắt buộc xác minh danh tính dù tổng giá trị mua dưới 10.000 yên?","Quần áo","Phần mềm game","Đồ nội thất","Tạp hóa","Phần mềm game, sách, CD/DVD, xe máy bắt buộc xác minh danh tính."
4,"Khi thương nhân đồ cũ ngừng kinh doanh, giấy phép phải trả lại trong thời hạn nào?","Ngay lập tức","Trong 10 ngày","Trong 14 ngày","Trong 30 ngày","Phải trả lại trong vòng 10 ngày kể từ ngày ngừng kinh doanh."
5,"Hình phạt cho việc kinh doanh đồ cũ không có giấy phép là gì?","Tù dưới 1 năm hoặc phạt dưới 500.000 yên","Tù dưới 3 năm hoặc phạt dưới 1.000.000 yên","Tù dưới 6 tháng hoặc phạt dưới 300.000 yên","Không có hình phạt","Kinh doanh không phép: tù dưới 3 năm hoặc phạt dưới 1.000.000 yên."
6,"Mặt hàng nào KHÔNG nằm trong 13 loại đồ cũ theo Luật kinh doanh đồ cũ?","Đồ mỹ thuật","Ô tô","Thiết bị y tế","Sách","Thiết bị y tế không nằm trong 13 loại đồ cũ."
7,"Điều nào thuộc lý do không đủ điều kiện để được cấp phép thương nhân đồ cũ?","Là người nước ngoài","Người không có nơi cư trú cố định","Có nợ","Từng vi phạm giao thông","Người không có nơi cư trú cố định không được cấp phép."
8,"Mô tả đúng về Quản lý cửa hàng là gì?","Người chưa thành niên cũng có thể làm","Mỗi cửa hàng phải chỉ định 1 người","Quản lý có thể kiêm nhiệm tất cả cửa hàng","Bắt buộc phải đỗ kỳ thi chứng chỉ","Mỗi cửa hàng bắt buộc phải có 1 quản lý."
9,"Khi kinh doanh nhiều loại đồ cũ, biển hiệu cửa hàng phải ghi gì?","Tất cả các loại kinh doanh","Một loại chính","Loại có doanh thu cao nhất","Tùy ý","Khi kinh doanh từ 2 loại trở lên, chỉ ghi một loại chính."
10,"Khi mua đồ cũ, nghĩa vụ xác minh danh tính phát sinh từ tổng số tiền bao nhiêu?","Từ 1.000 yên","Từ 3.000 yên","Từ 5.000 yên","Từ 10.000 yên","Cần xác minh danh tính khi tổng giá trị mua từ 10.000 yên trở lên."

11,"Mặt hàng ngoại lệ nào cần xác minh danh tính dù tổng giá trị mua dưới 10.000 yên?","Quần áo","Túi xách thương hiệu","Sách","Đồ nội thất","Sách, phần mềm game, CD/DVD, xe máy bắt buộc xác minh danh tính."
12,"Khi xác minh danh tính trực tiếp, chữ ký cần những thông tin gì?","Chỉ họ tên","Họ tên, số điện thoại","Địa chỉ, họ tên, nghề nghiệp, tuổi","Địa chỉ, họ tên, ngày sinh","Cần ghi 4 mục: địa chỉ, họ tên, nghề nghiệp, tuổi vào sổ sách."
13,"Khi phát hiện đồ cũ nghi là hàng gian, phải làm gì?","Báo ngay cho cảnh sát","Từ chối mua và cho khách về","Tạm giữ để theo dõi","Hỏi ý kiến đồng nghiệp","Khi nghi ngờ là hàng gian, có nghĩa vụ báo ngay cho cảnh sát."
14,"Tội danh nào bị truy cứu khi biết là hàng giả thương hiệu mà vẫn bán?","Tội trộm cắp","Tội biển thủ","Tội lừa đảo","Tội hủy hoại tài sản","Biết là hàng giả mà vẫn bán thì phạm tội lừa đảo."
15,"Khi kinh doanh đồ cũ trên internet, số giấy phép hiển thị trên website phải có bao nhiêu chữ số?","8 chữ số","10 chữ số","12 chữ số","13 chữ số","Phải hiển thị tên Ủy ban An ninh công cộng và số giấy phép 12 chữ số."
16,"Thời hạn thông báo khi bắt đầu/thay đổi/kết thúc kinh doanh đồ cũ trên internet?","3 ngày trước","Trong 1 tuần sau","Trong 14 ngày sau","Trong 30 ngày sau","Thông báo URL phải thực hiện trong vòng 14 ngày sau khi bắt đầu hoặc thay đổi."
17,"Mặt hàng nào có nghĩa vụ ghi chép địa chỉ, họ tên của người mua khi bán đồ cũ?","Quần áo","Đồng hồ, trang sức từ 10.000 yên","Đồ nội thất, đồ điện","Tất cả đồ cũ","Khi bán cần ghi chép: đồ mỹ thuật, đồng hồ/trang sức, ô tô, xe máy."
18,"Khi đi mua hàng tại nhà khách (hành thương), phải mang theo gì?","Bản sao hộ khẩu","Giấy phép đồ cũ hoặc thẻ nhân viên hành thương","Danh thiếp","Giấy chứng nhận con dấu","Khi hành thương, phải mang theo giấy phép hoặc thẻ nhân viên hành thương."
19,"Khi mở cửa hàng tạm để mua hàng, thời hạn thông báo cho đồn cảnh sát quản lý là?","Đến ngày hôm đó","Đến ngày hôm trước","3 ngày trước","1 tuần trước","Phải thông báo cho đồn cảnh sát quản lý khu vực 3 ngày trước ngày kinh doanh."
20,"Thời gian áp dụng quyền hủy hợp đồng (Cooling-off) trong mua hàng tại nhà là bao lâu?","3 ngày từ khi ký hợp đồng","8 ngày từ khi ký hợp đồng","14 ngày từ khi ký hợp đồng","30 ngày từ khi ký hợp đồng","Có thể hủy vô điều kiện trong 8 ngày kể từ ngày nhận văn bản."

21,"Mặt hàng nào KHÔNG thuộc đối tượng quy định mua hàng tại nhà (không được Cooling-off)?","Kim loại quý","Túi xách thương hiệu","Kimono","Đồ nội thất","Đồ nội thất, đồ điện lớn, sách, CD/DVD không thuộc đối tượng quy định."
22,"Thời gian lưu giữ Thông báo hàng (shinabure) từ cảnh sát là bao lâu?","3 tháng","6 tháng","1 năm","3 năm","Khi nhận thông báo hàng, phải ghi ngày nhận và lưu giữ 6 tháng."
23,"Nếu hàng mua vào là đồ ăn cắp, nạn nhân có thể yêu cầu trả lại miễn phí trong bao lâu?","1 năm từ khi bị mất cắp","2 năm từ khi bị mất cắp","3 năm từ khi bị mất cắp","5 năm từ khi bị mất cắp","Trong 2 năm kể từ khi bị mất cắp, nạn nhân có thể yêu cầu trả lại miễn phí."
24,"Trường hợp nào KHÔNG cần đổi giấy phép thương nhân đồ cũ?","Thay đổi tên cửa hàng","Thay đổi quản lý","Thay đổi địa chỉ đại diện","Thay đổi đại diện pháp nhân","Thay đổi quản lý chỉ cần thông báo thay đổi, không cần đổi giấy phép."
25,"Vi phạm Luật kinh doanh đồ cũ nào có thể bị đình chỉ kinh doanh?","Hành thương không mang giấy phép","Không tuân theo lệnh chỉ thị","Chữ viết trong sổ sách xấu","Không chào khách","Không tuân theo lệnh chỉ thị có thể bị đình chỉ kinh doanh."
26,"Phương pháp xác minh danh tính nào KHÔNG được chấp nhận khi mua hàng không trực tiếp?","Gửi thư bảo đảm chỉ người nhận và xác nhận đã đến","Nhận bản sao hộ khẩu (thư không chuyển tiếp)","Nhận email có chữ ký điện tử","Chỉ nhận bản sao bằng lái xe","Chỉ gửi bản sao bằng lái xe là không đủ, cần kết hợp với gửi thư bảo đảm."
27,"Khi mất hoặc hư hỏng sổ sách (hồ sơ giao dịch), phải làm gì?","Báo ngay cho trưởng đồn cảnh sát","Tạm ngừng kinh doanh cho đến khi tìm thấy","Viết lại theo trí nhớ vào sổ mới","Không cần làm gì","Khi mất sổ sách, có nghĩa vụ báo ngay cho trưởng đồn cảnh sát."
28,"Khi thương nhân đồ cũ mua hàng tại đấu giá với thiện ý mà hóa ra là đồ ăn cắp, có thể yêu cầu gì?","Không có nghĩa vụ trả lại","Phải trả lại miễn phí","Trả lại nếu được bồi thường giá đã trả","Trả lại nếu được trả một nửa","Khi mua tại đấu giá, có thể yêu cầu bồi thường giá đã trả để trả lại."
29,"Mô tả SAI về Thông báo hàng từ Cục trưởng Cảnh sát là gì?","Khi nhận phải ghi ngày nhận","Phải lưu giữ 6 tháng","Nếu có hàng phù hợp phải báo ngay","Vi phạm nghĩa vụ lưu giữ chỉ bị đình chỉ, không có hình phạt","Vi phạm nghĩa vụ lưu giữ có thể bị phạt tù dưới 6 tháng hoặc phạt tiền dưới 300.000 yên."
30,"Mô tả đúng về kiểm tra tại chỗ của cảnh sát tại cửa hàng là gì?","Không thể vào nếu không có sự đồng ý của chủ kinh doanh","Có thể từ chối nếu không có thông báo trước","Nếu từ chối có thể bị phạt tiền dưới 100.000 yên","Có thể từ chối nếu không có lệnh tòa án","Không có quyền từ chối kiểm tra của cảnh sát, nếu từ chối sẽ bị phạt tiền dưới 100.000 yên."

31,"Thời gian tối đa của lệnh giữ hàng khi cảnh sát nghi ngờ đồ cũ là đồ ăn cắp là bao lâu?","10 ngày","30 ngày","60 ngày","90 ngày","Thời gian lệnh giữ hàng được quy định trong vòng 30 ngày."
32,"Mặt hàng nào KHÔNG thuộc 4 loại đối tượng của Luật tái chế đồ gia dụng?","Điều hòa gia đình","Lò vi sóng","Tủ lạnh","Máy giặt","4 loại đồ gia dụng: điều hòa, TV, tủ lạnh/tủ đông, máy giặt/máy sấy. Lò vi sóng không thuộc đối tượng."
33,"Khi vứt bỏ máy tính có Nhãn tái chế PC, việc xử lý như thế nào?","Nhà sản xuất thu hồi không tính phí mới","Có thể bỏ như rác cồng kềnh cho chính quyền địa phương","Phải trả phí tái chế tại bưu điện","Cửa hàng bắt buộc phải mua lại","Máy tính có nhãn tái chế PC có thể được thu hồi mà không phải trả phí mới."
34,"Mặt hàng nào không thể bán nếu không có Nhãn PSC theo Luật an toàn sản phẩm tiêu dùng?","Xe đạp","Nồi áp suất gia đình","Bếp gas","Đèn bàn","Nồi áp suất gia đình, mũ bảo hiểm xe máy không thể bán nếu không có nhãn PSC."
35,"Mặt hàng nào thuộc Sản phẩm đặc định đặc biệt (hình thoi) có độ nguy hiểm cao hơn trong nhãn PSC?","Dây leo núi","Lò sưởi dầu","Nồi áp suất gia đình","Mũ bảo hiểm xe máy","Lò sưởi dầu, thiết bị dầu, giường trẻ sơ sinh là Sản phẩm đặc định đặc biệt (hình thoi)."
36,"Tiêu chuẩn số tiền cho giao dịch rủi ro cao cần lập hồ sơ theo Luật phòng chống chuyển tiền tội phạm?","Giao dịch tiền mặt trên 1.000.000 yên","Giao dịch tiền mặt trên 2.000.000 yên","Tất cả giao dịch kim loại quý","Giao dịch thẻ tín dụng trên 2.000.000 yên","Áp dụng cho giao dịch tiền mặt trên 2.000.000 yên khi mua bán kim loại quý."
37,"Hành vi nào bị cấm khi cửa hàng tái sử dụng đến nhà khách hàng để mua hàng?","Yêu cầu bán hàng khác ngoài hàng đã hẹn trước","Xuất trình danh thiếp và giấy phép","Giao hợp đồng","Giải thích về Cooling-off","Cấm đến không hẹn trước hoặc chào mua hàng không hẹn trước."
38,"Thời gian người tiêu dùng có thể thực hiện quyền từ chối giao hàng trong mua hàng tại nhà?","Chỉ ngày ký hợp đồng","3 ngày từ khi ký hợp đồng","Trong thời gian Cooling-off (8 ngày)","Cho đến khi nhận tiền","Trong thời gian Cooling-off, có thể từ chối giao hàng."
39,"Mặt hàng nào thuộc đối tượng quy định mua hàng tại nhà (có thể Cooling-off)?","Ô tô","Đồ nội thất lớn","Tủ lạnh","Kim loại quý (nhẫn)","Ô tô, đồ nội thất, đồ điện, sách, CD được miễn trừ, nhưng kim loại quý thuộc đối tượng quy định."
40,"Sau khi thương nhân đồ cũ bị thu hồi giấy phép, bao lâu sau mới có thể xin cấp phép lại?","Sau 1 năm","Sau 2 năm","Sau 3 năm","Sau 5 năm","Người bị thu hồi giấy phép không thể xin cấp phép trong vòng 5 năm."

41,"Điều nào KHÔNG phù hợp với định nghĩa đồ cũ theo Luật kinh doanh đồ cũ?","Vật phẩm đã sử dụng một lần","Vật phẩm chưa sử dụng nhưng đã giao dịch để sử dụng","Vật phẩm đã được bảo dưỡng một phần","Phế phẩm không thể sử dụng theo mục đích ban đầu","Phế phẩm không thể đạt mục đích ban đầu không phải là đồ cũ."
42,"Theo Luật trách nhiệm sản phẩm (PL), ai chịu trách nhiệm khi đồ cũ bán tại cửa hàng gây cháy nhà?","Cửa hàng tái sử dụng đã bán","Nhà sản xuất sản phẩm","Chủ cũ (người yêu cầu mua)","Cục bảo vệ người tiêu dùng","Nguyên tắc nhà sản xuất chịu trách nhiệm. Tuy nhiên, nếu có gia công hoặc nhập khẩu thì có thể thuộc đối tượng."
43,"Trường hợp nào có thể cung cấp thông tin cá nhân cho bên thứ ba mà không cần sự đồng ý?","Để gửi DM cho công ty liên kết","Đáp ứng yêu cầu điều tra của cảnh sát","Công khai lịch sử mua hàng trên web","Không có trường hợp nào","Trường hợp theo quy định pháp luật (điều tra cảnh sát) có thể cung cấp thông tin cá nhân mà không cần sự đồng ý."
44,"Nghĩa vụ đúng của người kinh doanh đấu giá internet (kinh doanh loại 3) là gì?","Báo cảnh sát khi biết có hàng ăn cắp được đăng bán","Xác minh danh tính người bán bằng bằng lái xe gốc","Tự mua tất cả hàng hóa","Đảm bảo Cooling-off cho người mua","Người kinh doanh môi giới đấu giá có nghĩa vụ báo cảnh sát khi nghi ngờ có hàng ăn cắp."
45,"Địa điểm nào thương nhân đồ cũ có thể thực hiện hành thương?","Đường phố hoặc công viên","Quán cà phê hoặc nhà hàng","Nhà ở của đối tác giao dịch (khách hàng)","Trong ga tàu","Hành thương (mua hàng tại nhà) được phép thực hiện tại địa chỉ hoặc nhà ở của đối tác."
46,"Khi kinh doanh tại cửa hàng tạm, ngoài đồn cảnh sát quản lý khu vực, có thể thông báo qua đâu?","Không thể qua đâu khác","Ủy ban An ninh công cộng quản lý trụ sở chính","Ủy ban nhân dân","Phòng thương mại","Nếu được Ủy ban An ninh công cộng cấp phép, có thể kinh doanh tại tỉnh khác chỉ với thông báo."
47,"Khi tìm thấy giấy phép cũ sau khi đã được cấp lại do mất, phải làm gì?","Giữ giấy cũ làm kỷ niệm","Trả lại giấy mới","Trả lại ngay giấy cũ tìm được","Trả lại giấy nào đẹp hơn","Khi tìm thấy giấy phép cũ, phải nhanh chóng trả lại kèm theo lý do."
48,"Vi phạm Luật kinh doanh đồ cũ nào bị phạt tù dưới 6 tháng hoặc phạt tiền dưới 300.000 yên?","Kinh doanh không phép","Cho mượn tên","Vi phạm nghĩa vụ ghi sổ sách","Lấy giấy phép bằng thủ đoạn gian dối","Vi phạm nghĩa vụ ghi sổ sách hoặc lưu giữ thông báo hàng bị phạt tù dưới 6 tháng hoặc phạt tiền dưới 300.000 yên."
49,"Trường hợp nào KHÔNG cần trả lại giấy phép?","Khi ngừng kinh doanh đồ cũ","Khi bị thu hồi giấy phép","Khi tìm thấy giấy cũ sau khi được cấp lại","Khi tạm ngừng kinh doanh 1 tháng","Chỉ tạm ngừng không cần trả lại (nhưng tạm ngừng trên 6 tháng có thể bị thu hồi)."
50,"Khi thương nhân đồ cũ mở website để giao dịch, thông tin nào phải hiển thị trên trang chủ?","Ảnh cửa hàng","Tên nhân viên","Tên Ủy ban An ninh công cộng và số giấy phép","Danh sách tất cả hàng tồn kho","Có nghĩa vụ hiển thị tên Ủy ban An ninh công cộng đã cấp phép và số giấy phép 12 chữ số."

51,"Điều nào KHÔNG thuộc đồ cũ?","Đá cảnh","Phiếu quà tặng (thương phẩm quyền)","Quần áo cũ","Máy chơi game cũ","Đá cảnh, lon rỗng, phế liệu kim loại không thuộc đồ cũ (phiếu quà tặng thuộc đồ cũ)."
52,"Việc mua hàng tạp hóa ở nước ngoài rồi bán tại cửa hàng của mình ở Nhật có phải là kinh doanh đồ cũ không?","Có (cần giấy phép)","Không (không cần giấy phép)","Tùy theo số tiền","Nếu giá bán từ 10.000 yên trở lên thì có","Việc tự mình mua hàng ở nước ngoài rồi bán không phải là kinh doanh đồ cũ."
53,"Trong 3R của kỳ thi Reuse, thứ tự ưu tiên cao nhất là gì?","Recycle (Tái chế)","Reuse (Tái sử dụng)","Reduce (Giảm thiểu)","Tất cả như nhau","Thông thường 3R được ưu tiên theo thứ tự Reduce > Reuse > Recycle."
54,"Nghiệp vụ mà chủ chợ đồ cũ (kinh doanh loại 2) có thể thực hiện là gì?","Mua hàng từ khách hàng thông thường","Vận hành chợ để mua bán giữa các thương nhân đồ cũ","Cung cấp hệ thống đấu giá internet","Kinh doanh cửa hàng tái chế","Chủ chợ đồ cũ vận hành chợ để các thương nhân đồ cũ mua bán, trao đổi với nhau."
55,"Nội dung nghiệp vụ chính của người kinh doanh môi giới đấu giá đồ cũ (kinh doanh loại 3) là gì?","Mua bán đồ cũ","Cho thuê địa điểm chợ đồ cũ","Cung cấp hệ thống đấu giá (internet)","Kinh doanh cửa hàng tái chế","Đây là kinh doanh cung cấp hệ thống mua bán đồ cũ (đấu giá) qua internet."
56,"Khi nộp đơn xin cấp phép, cần bản sao hộ khẩu của ai?","Chỉ đại diện","Chỉ quản lý","Tất cả cán bộ và quản lý","Tất cả nhân viên","Đối với pháp nhân, cần bản sao hộ khẩu của tất cả cán bộ (bao gồm kiểm soát viên) và quản lý cửa hàng."
57,"Nếu bị phạt tiền do vi phạm Luật kinh doanh đồ cũ, không thể xin cấp phép trong bao nhiêu năm?","1 năm","2 năm","3 năm","5 năm","Nếu bị phạt tiền do một số tội (trộm cắp, vi phạm Luật kinh doanh đồ cũ), không thể xin cấp phép trong 5 năm."
58,"Khi thay đổi quản lý cửa hàng, phải thông báo thay đổi trong thời hạn nào?","Trước khi thay đổi","Trong 14 ngày kể từ ngày thay đổi","Trong 30 ngày kể từ ngày thay đổi","Ngay lập tức (trong 24 giờ)","Thay đổi quản lý phải thông báo cho Ủy ban An ninh công cộng qua đồn cảnh sát trong vòng 14 ngày."
59,"Hình phạt cho việc cho mượn tên (cho người khác kinh doanh bằng giấy phép của mình) là gì?","Chỉ lệnh chỉ thị","Chỉ đình chỉ kinh doanh","Tù dưới 1 năm","Tù dưới 3 năm hoặc phạt tiền dưới 1.000.000 yên","Cho mượn tên hoặc kinh doanh không phép bị phạt nặng nhất: tù dưới 3 năm hoặc phạt tiền dưới 1.000.000 yên."
60,"Khi mua đồ cũ từ pháp nhân, cần xác nhận thông tin gì của người phụ trách giao dịch?","Chỉ giấy chứng nhận đăng ký pháp nhân","Chỉ thẻ nhân viên của người phụ trách","Địa chỉ, họ tên, tuổi, nghề nghiệp của người phụ trách","Địa chỉ của đại diện pháp nhân","Dù là pháp nhân, vẫn cần xác nhận địa chỉ, họ tên, tuổi, nghề nghiệp của người phụ trách giao dịch thực tế."

61,"Khi cửa hàng tái sử dụng bán xe máy, mục nào KHÔNG cần ghi vào sổ sách?","Ngày bán","Đặc điểm của đồ cũ","Nghề nghiệp của đối tác","Thành phần gia đình của đối tác","Mục ghi khi bán: ngày bán, tên/số lượng/đặc điểm của đồ cũ, địa chỉ/họ tên/tuổi/nghề nghiệp của đối tác."
62,"Khi mua đồ cũ rồi tháo rời để bán linh kiện, có cần giấy phép kinh doanh đồ cũ không?","Cần","Không cần","Chỉ cần khi bán phần kim loại","Chỉ cần khi bán phần nhựa","Việc mua đồ cũ rồi bán linh kiện có thể sử dụng cũng thuộc kinh doanh đồ cũ."
63,"Khi bán thiết bị văn phòng đã sử dụng cho nhân viên với giá rẻ, có cần giấy phép thương nhân đồ cũ không?","Cần","Không cần","Cần nếu từ 5 chiếc trở lên","Cần nếu từ 10.000 yên trở lên","Việc bán vật phẩm đã sử dụng của mình không phải là kinh doanh, nên không cần giấy phép."
64,"Khi bán đồ điện gia dụng nhận miễn phí sau khi sửa chữa, có cần giấy phép thương nhân đồ cũ không?","Cần","Không cần","Tùy theo giá bán","Cần nếu có phí sửa chữa","Vật phẩm nhận miễn phí (không mua) không phải là kinh doanh đồ cũ."
65,"Khi thương nhân đồ cũ thực hiện hành thương, nhân viên phải mang theo gì?","Bản sao hộ khẩu","Bản gốc giấy phép","Thẻ nhân viên hành thương","Bằng lái xe","Khi nhân viên thực hiện hành thương, có nghĩa vụ mang theo thẻ nhân viên hành thương."
66,"Thời hạn hiệu lực của thẻ nhân viên hành thương là bao lâu?","1 năm","3 năm","5 năm","Không có quy định đặc biệt (miễn là còn là nhân viên)","Thẻ nhân viên hành thương không có thời hạn hiệu lực theo pháp luật, nhưng cần thu hồi khi nghỉ việc."
67,"Khi thương nhân đồ cũ thay đổi URL website, phải thông báo thay đổi trong thời hạn nào?","3 ngày trước khi thay đổi","Ngày thay đổi","Trong 14 ngày sau khi thay đổi","Trong 30 ngày sau khi thay đổi","Thay đổi URL cũng cần thông báo trong vòng 14 ngày sau khi thay đổi."
68,"Trường hợp nào cần nộp đơn xin cấp lại giấy phép?","Khi thay đổi địa chỉ đại diện","Khi thay đổi cán bộ pháp nhân","Khi mất giấy phép","Khi thay đổi quản lý","Khi mất hoặc hư hỏng giấy phép cần nộp đơn xin cấp lại. Các trường hợp khác xử lý bằng thông báo thay đổi."
69,"Phương pháp lưu giữ sổ sách theo Luật kinh doanh đồ cũ là gì?","Chỉ được dùng sổ giấy","Có thể dùng máy tính (hồ sơ điện tử)","Phải gửi cho đồn cảnh sát","Phải lưu giữ tại hiệp hội","Nếu đáp ứng một số điều kiện, có thể ghi chép và lưu giữ bằng máy tính."
70,"Trường hợp nào được miễn nghĩa vụ ghi sổ sách (không cần ghi)?","Tất cả trường hợp dưới 10.000 yên","Linh kiện dưới 10.000 yên","Phần mềm game dưới 10.000 yên","Không có trường hợp nào được miễn","Nếu tổng giá trị dưới 10.000 yên, được miễn nghĩa vụ ghi chép trừ một số mặt hàng ngoại lệ."

71,"Khi thương nhân đồ cũ vi phạm lệnh đình chỉ kinh doanh và tiếp tục kinh doanh, hậu quả là gì?","Bị cảnh cáo nghiêm khắc","Chỉ bị phạt tiền","Bị thu hồi giấy phép","Chỉ cần nộp bản kiểm điểm","Vi phạm lệnh đình chỉ kinh doanh là lý do thu hồi giấy phép."
72,"Đối tượng báo cáo nghĩa vụ báo cáo hàng gian là ai?","Trung tâm tiêu dùng","Cảnh sát","Tỉnh trưởng","Ủy ban thương mại công bằng","Khi nghi ngờ là hàng gian, phải báo ngay cho cảnh sát."
73,"Khi nhận được thông báo hàng nhưng không có hàng phù hợp, có cần lưu giữ thông báo hàng không?","Không cần","Lưu giữ 1 tháng","Lưu giữ 3 tháng","Lưu giữ 6 tháng","Dù không có hàng phù hợp, vẫn phải ghi ngày nhận và lưu giữ 6 tháng."
74,"Khi người chưa thành niên (chưa kết hôn) bán đồ cũ, cần lưu ý điều gì?","Tuyệt đối không được mua","Xác nhận giấy đồng ý của người giám hộ","Có thể mua nếu có giấy tờ tùy thân","Không cần đồng ý nếu dưới 10.000 yên","Theo luật dân sự, hành vi pháp lý của người chưa thành niên cần sự đồng ý của người đại diện theo pháp luật, cũng cần lưu ý điều lệ bảo vệ thanh thiếu niên."
75,"Người kinh doanh môi giới đấu giá đồ cũ (người vận hành đấu giá mạng) khi phát hiện hàng ăn cắp được đăng bán có nghĩa vụ gì?","Nghĩa vụ báo cảnh sát (bao gồm nghĩa vụ nỗ lực)","Chỉ cảnh báo người bán","Hoàn tiền cho người mua","Tự mua hàng","Người kinh doanh môi giới đấu giá khi nghi ngờ có hàng ăn cắp phải nỗ lực thực hiện các biện pháp được công nhận như báo cảnh sát (nghĩa vụ nỗ lực)."
76,"Giao dịch nào thuộc đối tượng quy định của Luật giao dịch thương mại đặc định?","Giao dịch giữa doanh nghiệp (BtoB)","Bán hàng tại cửa hàng","Bán hàng qua mạng hoặc bán hàng tại nhà (BtoC)","Giao dịch với nước ngoài","Bán hàng qua internet (bán hàng từ xa) hoặc mua hàng tại nhà thuộc đối tượng quy định của Luật giao dịch thương mại đặc định."
