id,question_vi,option1_vi,option2_vi,option3_vi,option4_vi,explanation_vi
77,"Mục nào KHÔNG thuộc nghĩa vụ hiển thị theo Luật giao dịch thương mại đặc định trên website bán hàng qua internet?","Giá bán","Thời điểm thanh toán","Nhóm máu của doanh nghiệp","Thời điểm giao hàng","Cần hiển thị tên (danh xưng), địa chỉ, số điện thoại, giá cả, thời điểm thanh toán, thời điểm giao hàng của doanh nghiệp."
78,"Khi người kinh doanh mua hàng tại nhà bán hàng cho bên thứ ba trong thời gian Cooling-off, chủ cũ sẽ như thế nào?","Mất quyền sở hữu","Có thể yêu cầu bên thứ ba trả lại (đối kháng)","Chỉ có thể chịu thiệt","Chỉ được hoàn lại một nửa","Trong thời gian Cooling-off, nếu hàng được chuyển cho bên thứ ba, người tiêu dùng có thể yêu cầu bên thứ ba đó trả lại hàng."
79,"Có thể bán đồ điện gia dụng không có nhãn PSE (Luật an toàn đồ điện) không?","Có thể","Không thể","Có thể nếu là hàng junk","Có thể nếu là đồ cổ","Sản phẩm thuộc đối tượng của Luật an toàn đồ điện không thể bán (bao gồm trưng bày) nếu không có nhãn PSE."
80,"Sự khác biệt giữa sản phẩm đặc định và sản phẩm đặc định đặc biệt của Luật an toàn sản phẩm tiêu dùng (nhãn PSC) là gì?","Hình dạng nhãn (tròn hoặc hình thoi)","Nước sản xuất","Giá cả","Kênh bán hàng","Sản phẩm đặc định có nhãn PSC tròn, sản phẩm đặc định đặc biệt có độ nguy hiểm cao hơn có nhãn PSC hình thoi."

81,"Bật lửa (loại dùng một lần) thuộc phân loại nào trong chế độ nhãn PSC?","Không thuộc đối tượng","Sản phẩm đặc định (tròn)","Sản phẩm đặc định đặc biệt (hình thoi)","Sản phẩm khuyến nghị","Bật lửa được chỉ định là sản phẩm đặc định đặc biệt, bắt buộc phải có nhãn PSC hình thoi."
82,"Khi bán lò sưởi dầu, cần nhãn PSC hình dạng nào?","Tròn (sản phẩm đặc định)","Hình thoi (sản phẩm đặc định đặc biệt)","Vuông","Tam giác","Lò sưởi dầu là sản phẩm đặc định đặc biệt, cần nhãn PSC hình thoi."
83,"Khi cửa hàng tái sử dụng bán thiết bị y tế, cần giấy phép nào?","Chỉ cần giấy phép thương nhân đồ cũ","Cần thông báo/giấy phép cho cơ quan y tế","Cần giấy phép bác sĩ","Cần có dược sĩ thường trực","Để bán thiết bị y tế quản lý, ngoài giấy phép thương nhân đồ cũ còn cần thông báo hoặc giấy phép theo Luật dược phẩm và thiết bị y tế."
84,"Tiêu chuẩn số tiền cho giao dịch rủi ro cao cần lập hồ sơ xác minh danh tính và hồ sơ giao dịch theo Luật phòng chống chuyển tiền tội phạm?","Giao dịch tiền mặt trên 1.000.000 yên","Giao dịch tiền mặt trên 2.000.000 yên","Tất cả giao dịch kim loại quý","Giao dịch thẻ tín dụng trên 2.000.000 yên","Áp dụng cho giao dịch tiền mặt trên 2.000.000 yên khi mua bán kim loại quý."
85,"Khi thu hồi 4 loại đồ gia dụng thuộc đối tượng Luật tái chế đồ gia dụng, phải phát hành giấy tờ gì cho người thải bỏ (khách)?","Phiếu tái chế đồ gia dụng (phiếu quản lý)","Giấy chứng nhận thải bỏ","Chỉ biên lai","Giấy đăng ký xe","Khi thu hồi 4 loại đối tượng, phải phát hành phiếu tái chế đồ gia dụng (phiếu quản lý) và lưu giữ bản sao."
86,"Khi thải bỏ máy tính cũ không có nhãn tái chế PC, ai chịu phí thu hồi tái chế?","Nhà sản xuất","Nhà nước","Người thải bỏ (chủ sở hữu)","Cửa hàng tái sử dụng","Máy tính không có nhãn, người thải bỏ (chủ sở hữu) phải chịu phí thu hồi tái chế khi thải bỏ."
87,"Mục nào thuộc mã nhận dạng cá nhân theo Luật bảo vệ thông tin cá nhân?","Dữ liệu vân tay hoặc số hộ chiếu","Chỉ địa chỉ email","Chỉ số điện thoại","Địa chỉ cửa hàng","Dữ liệu vân tay, xác thực tĩnh mạch, số My Number, số bằng lái xe, số hộ chiếu thuộc mã nhận dạng cá nhân."
88,"Ngoài vi phạm Luật kinh doanh đồ cũ, trường hợp nào có thể bị thu hồi giấy phép thương nhân đồ cũ?","Vi phạm giao thông","Không trả thuế","Phạm tội trộm cắp","Tranh chấp dân sự","Nếu phạm một số tội như trộm cắp, lừa đảo, vi phạm Luật kinh doanh đồ cũ và bị phạt tiền, có thể bị thu hồi giấy phép."